Itemset,Size,Support_Count,Support_Percentage,Support_Decimal
"JUMBO BAG TOYS, JUMBO STORAGE BAG SKULLS",2,111,0.79%,0.00788912579957356
"BATHROOM METAL SIGN, WOODEN FRAME ANTIQUE WHITE",2,101,0.72%,0.007178393745557924
"PACK OF 60 DINOSAUR CAKE CASES, WHITE HANGING HEART T-LIGHT HOLDER",2,112,0.80%,0.007960199004975124
"DOOR MAT NEW ENGLAND, DOOR MAT UNION FLAG",2,123,0.87%,0.008742004264392323
"DOOR MAT UNION FLAG, WHITE HANGING HEART T-LIGHT HOLDER",2,168,1.19%,0.011940298507462687
"PARTY BUNTING, PINK HAPPY BIRTHDAY BUNTING",2,105,0.75%,0.007462686567164179
"POSTAGE, ROUND SNACK BOXES SET OF 4 FRUITS",2,105,0.75%,0.007462686567164179
"POSTAGE, ROUND SNACK BOXES SET OF4 WOODLAND",2,169,1.20%,0.01201137171286425
"ROUND SNACK BOXES SET OF 4 FRUITS, ROUND SNACK BOXES SET OF4 WOODLAND",2,241,1.71%,0.01712864250177683
"LUNCH BAG RED SPOTTY, ROUND SNACK BOXES SET OF 4 FRUITS",2,115,0.82%,0.008173418621179816
"LUNCH BAG RED SPOTTY, ROUND SNACK BOXES SET OF4 WOODLAND",2,109,0.77%,0.007746979388770434
"LUNCH BAG WOODLAND, ROUND SNACK BOXES SET OF 4 FRUITS",2,108,0.77%,0.00767590618336887
"LUNCH BAG WOODLAND, ROUND SNACK BOXES SET OF4 WOODLAND",2,141,1.00%,0.010021321961620469
"ROUND SNACK BOXES SET OF4 WOODLAND, WOODLAND CHARLOTTE BAG",2,104,0.74%,0.0073916133617626155
"RECYCLING BAG RETROSPOT, TOY TIDY PINK RETROSPOT",2,221,1.57%,0.01570717839374556
"RECYCLING BAG RETROSPOT, WHITE HANGING HEART T-LIGHT HOLDER",2,114,0.81%,0.00810234541577825
"JUMBO STORAGE BAG SUKI, RECYCLING BAG RETROSPOT",2,112,0.80%,0.007960199004975124
"LUNCH BAG CARS BLUE, RECYCLING BAG RETROSPOT",2,106,0.75%,0.007533759772565742
"LUNCH BAG RED SPOTTY, RECYCLING BAG RETROSPOT",2,120,0.85%,0.008528784648187633
"JUMBO  BAG BAROQUE BLACK WHITE, JUMBO BAG PINK WITH WHITE SPOTS",2,193,1.37%,0.013717128642501776
"JUMBO BAG PINK VINTAGE PAISLEY, JUMBO BAG PINK WITH WHITE SPOTS",2,159,1.13%,0.011300639658848614
"JUMBO BAG PINK WITH WHITE SPOTS, JUMBO BAG RED WHITE SPOTTY",2,100,0.71%,0.007107320540156361
"JUMBO BAG PINK WITH WHITE SPOTS, JUMBO BAG SCANDINAVIAN PAISLEY",2,186,1.32%,0.013219616204690832
"JUMBO BAG PINK WITH WHITE SPOTS, JUMBO BAG STRAWBERRY",2,288,2.05%,0.02046908315565032
"JUMBO BAG PINK WITH WHITE SPOTS, JUMBO BAG TOYS",2,131,0.93%,0.009310589907604833
"JUMBO BAG PINK WITH WHITE SPOTS, JUMBO STORAGE BAG SKULLS",2,170,1.21%,0.012082444918265814
"JUMBO BAG PINK WITH WHITE SPOTS, JUMBO STORAGE BAG SUKI",2,260,1.85%,0.01847903340440654
"JUMBO BAG PINK WITH WHITE SPOTS, TOY TIDY PINK RETROSPOT",2,139,0.99%,0.009879175550817342
"JUMBO BAG PINK WITH WHITE SPOTS, JUMBO BAG SPACEBOY DESIGN",2,205,1.46%,0.01457000710732054
"JUMBO BAG PINK WITH WHITE SPOTS, RECYCLING BAG RETROSPOT",2,116,0.82%,0.00824449182658138
"JUMBO BAG OWLS, JUMBO SHOPPER VINTAGE RED PAISLEY",2,158,1.12%,0.01122956645344705
"JUMBO SHOPPER VINTAGE RED PAISLEY, JUMBO STORAGE BAG SUKI",2,307,2.18%,0.02181947405828003
"JUMBO SHOPPER VINTAGE RED PAISLEY, RECYCLING BAG RETROSPOT",2,116,0.82%,0.00824449182658138
"GIN + TONIC DIET METAL SIGN, METAL SIGN TAKE IT OR LEAVE IT",2,156,1.11%,0.011087420042643924
"LADIES & GENTLEMEN METAL SIGN, METAL SIGN TAKE IT OR LEAVE IT",2,115,0.82%,0.008173418621179816
"JUMBO BAG PINK WITH WHITE SPOTS, JUMBO SHOPPER VINTAGE RED PAISLEY",2,260,1.85%,0.01847903340440654
"JUMBO BAG PINK WITH WHITE SPOTS, LUNCH BAG RED SPOTTY",2,185,1.31%,0.013148542999289269
"JUMBO BAG PINK WITH WHITE SPOTS, LUNCH BAG WOODLAND",2,111,0.79%,0.00788912579957356
"JUMBO SHOPPER VINTAGE RED PAISLEY, LUNCH BAG RED SPOTTY",2,155,1.10%,0.01101634683724236
"JUMBO SHOPPER VINTAGE RED PAISLEY, LUNCH BAG WOODLAND",2,107,0.76%,0.007604832977967307
"JUMBO SHOPPER VINTAGE RED PAISLEY, PACK OF 60 PINK PAISLEY CAKE CASES",2,100,0.71%,0.007107320540156361
"CHOCOLATE HOT WATER BOTTLE, PLEASE ONE PERSON METAL SIGN",2,104,0.74%,0.0073916133617626155
"CHOCOLATE THIS WAY METAL SIGN, PLEASE ONE PERSON METAL SIGN",2,116,0.82%,0.00824449182658138
"COOK WITH WINE METAL SIGN, PLEASE ONE PERSON METAL SIGN",2,248,1.76%,0.017626154939587774
"GIN + TONIC DIET METAL SIGN, PLEASE ONE PERSON METAL SIGN",2,260,1.85%,0.01847903340440654
"HAND OVER THE CHOCOLATE   SIGN, PLEASE ONE PERSON METAL SIGN",2,226,1.61%,0.016062544420753375
"HOME BUILDING BLOCK WORD, PLEASE ONE PERSON METAL SIGN",2,118,0.84%,0.008386638237384506
"PLEASE ONE PERSON METAL SIGN, WHITE HANGING HEART T-LIGHT HOLDER",2,235,1.67%,0.016702203269367447
"BATHROOM METAL SIGN, PLEASE ONE PERSON METAL SIGN",2,108,0.77%,0.00767590618336887
"PLEASE ONE PERSON METAL SIGN, RED HANGING HEART T-LIGHT HOLDER",2,103,0.73%,0.007320540156361052
"NO SINGING METAL SIGN, PLEASE ONE PERSON METAL SIGN",2,193,1.37%,0.013717128642501776
"LADIES & GENTLEMEN METAL SIGN, PLEASE ONE PERSON METAL SIGN",2,168,1.19%,0.011940298507462687
"PLEASE ONE PERSON METAL SIGN, POTTERING IN THE SHED METAL SIGN",2,129,0.92%,0.009168443496801706
"JUMBO BAG SPACEBOY DESIGN, JUMBO SHOPPER VINTAGE RED PAISLEY",2,202,1.44%,0.014356787491115849
"JUMBO BAG SPACEBOY DESIGN, LUNCH BAG CARS BLUE",2,113,0.80%,0.008031272210376687
"JUMBO SHOPPER VINTAGE RED PAISLEY, LUNCH BAG CARS BLUE",2,127,0.90%,0.009026297085998579
"JUMBO SHOPPER VINTAGE RED PAISLEY, WHITE HANGING HEART T-LIGHT HOLDER",2,155,1.10%,0.01101634683724236
"PACK OF 60 SPACEBOY CAKE CASES, PACK OF 72 RETRO SPOT CAKE CASES",2,191,1.36%,0.01357498223169865
"PLEASE ONE PERSON METAL SIGN, STRAWBERRY CERAMIC TRINKET BOX",2,103,0.73%,0.007320540156361052
"JUMBO  BAG BAROQUE BLACK WHITE, JUMBO BAG SPACEBOY DESIGN",2,134,0.95%,0.009523809523809525
"JUMBO  BAG BAROQUE BLACK WHITE, JUMBO SHOPPER VINTAGE RED PAISLEY",2,242,1.72%,0.017199715707178393
"JUMBO BAG PINK VINTAGE PAISLEY, JUMBO BAG SPACEBOY DESIGN",2,123,0.87%,0.008742004264392323
"JUMBO BAG PINK VINTAGE PAISLEY, JUMBO SHOPPER VINTAGE RED PAISLEY",2,230,1.63%,0.016346837242359632
"JUMBO BAG SCANDINAVIAN PAISLEY, JUMBO BAG SPACEBOY DESIGN",2,121,0.86%,0.008599857853589197
"JUMBO BAG SCANDINAVIAN PAISLEY, JUMBO SHOPPER VINTAGE RED PAISLEY",2,257,1.83%,0.018265813788201846
"JUMBO BAG SPACEBOY DESIGN, JUMBO STORAGE BAG SUKI",2,236,1.68%,0.016773276474769012
"JUMBO BAG PINK WITH WHITE SPOTS, PACK OF 72 RETRO SPOT CAKE CASES",2,108,0.77%,0.00767590618336887
"JUMBO BAG PINK WITH WHITE SPOTS, WHITE HANGING HEART T-LIGHT HOLDER",2,147,1.04%,0.010447761194029851
"60 TEATIME FAIRY CAKE CASES, LUNCH BAG PINK RETROSPOT",2,108,0.77%,0.00767590618336887
"LUNCH BAG  BLACK SKULL., LUNCH BAG PINK RETROSPOT",2,288,2.05%,0.02046908315565032
"LUNCH BAG CARS BLUE, LUNCH BAG PINK RETROSPOT",2,298,2.12%,0.021179815209665956
"LUNCH BAG PINK RETROSPOT, LUNCH BAG RED SPOTTY",2,394,2.80%,0.028002842928216063
"LUNCH BAG PINK RETROSPOT, LUNCH BAG WOODLAND",2,254,1.81%,0.018052594171997158
"LUNCH BAG PINK RETROSPOT, PACK OF 72 RETRO SPOT CAKE CASES",2,111,0.79%,0.00788912579957356
"LUNCH BAG PINK RETROSPOT, WHITE HANGING HEART T-LIGHT HOLDER",2,183,1.30%,0.01300639658848614
"JUMBO BAG PINK WITH WHITE SPOTS, LUNCH BAG  BLACK SKULL.",2,123,0.87%,0.008742004264392323
"JUMBO SHOPPER VINTAGE RED PAISLEY, LUNCH BAG  BLACK SKULL.",2,122,0.87%,0.00867093105899076
"72 SWEETHEART FAIRY CAKE CASES, PACK OF 60 SPACEBOY CAKE CASES",2,152,1.08%,0.010803127221037668
"JUMBO BAG OWLS, JUMBO BAG PINK WITH WHITE SPOTS",2,104,0.74%,0.0073916133617626155
"JUMBO BAG OWLS, LUNCH BAG SUKI  DESIGN",2,103,0.73%,0.007320540156361052
"JUMBO BAG PINK WITH WHITE SPOTS, LUNCH BAG PINK RETROSPOT",2,236,1.68%,0.016773276474769012
"JUMBO BAG PINK WITH WHITE SPOTS, LUNCH BAG SPACEBOY DESIGN",2,132,0.94%,0.009381663113006396
"JUMBO BAG PINK WITH WHITE SPOTS, LUNCH BAG SUKI  DESIGN",2,158,1.12%,0.01122956645344705
"JUMBO BAG PINK WITH WHITE SPOTS, RED SPOTTY CHARLOTTE BAG",2,118,0.84%,0.008386638237384506
"JUMBO BAG SCANDINAVIAN PAISLEY, LUNCH BAG SUKI  DESIGN",2,114,0.81%,0.00810234541577825
"JUMBO BAG STRAWBERRY, JUMBO SHOPPER VINTAGE RED PAISLEY",2,267,1.90%,0.018976545842217484
"JUMBO BAG STRAWBERRY, LUNCH BAG PINK RETROSPOT",2,149,1.06%,0.010589907604832978
"JUMBO BAG STRAWBERRY, LUNCH BAG SPACEBOY DESIGN",2,119,0.85%,0.00845771144278607
"JUMBO BAG STRAWBERRY, LUNCH BAG SUKI  DESIGN",2,163,1.16%,0.011584932480454868
"JUMBO SHOPPER VINTAGE RED PAISLEY, LUNCH BAG PINK RETROSPOT",2,141,1.00%,0.010021321961620469
"JUMBO SHOPPER VINTAGE RED PAISLEY, LUNCH BAG SPACEBOY DESIGN",2,153,1.09%,0.010874200426439232
"JUMBO SHOPPER VINTAGE RED PAISLEY, LUNCH BAG SUKI  DESIGN",2,189,1.34%,0.013432835820895522
"JUMBO STORAGE BAG SUKI, LUNCH BAG PINK RETROSPOT",2,163,1.16%,0.011584932480454868
"JUMBO STORAGE BAG SUKI, LUNCH BAG SPACEBOY DESIGN",2,175,1.24%,0.012437810945273632
"JUMBO STORAGE BAG SUKI, LUNCH BAG SUKI  DESIGN",2,292,2.08%,0.020753375977256575
"LUNCH BAG PINK RETROSPOT, LUNCH BAG SPACEBOY DESIGN",2,317,2.25%,0.022530206112295663
"LUNCH BAG PINK RETROSPOT, LUNCH BAG SUKI  DESIGN",2,328,2.33%,0.023312011371712866
"LUNCH BAG PINK RETROSPOT, RED SPOTTY CHARLOTTE BAG",2,132,0.94%,0.009381663113006396
"LUNCH BAG PINK RETROSPOT, STRAWBERRY CHARLOTTE BAG",2,103,0.73%,0.007320540156361052
"LUNCH BAG SPACEBOY DESIGN, LUNCH BAG SUKI  DESIGN",2,454,3.23%,0.03226723525230988
"LUNCH BAG SPACEBOY DESIGN, PACK OF 60 SPACEBOY CAKE CASES",2,121,0.86%,0.008599857853589197
"LUNCH BAG SPACEBOY DESIGN, RED SPOTTY CHARLOTTE BAG",2,122,0.87%,0.00867093105899076
"LUNCH BAG SPACEBOY DESIGN, STRAWBERRY CHARLOTTE BAG",2,116,0.82%,0.00824449182658138
"LUNCH BAG SPACEBOY DESIGN, WHITE HANGING HEART T-LIGHT HOLDER",2,182,1.29%,0.012935323383084577
"LUNCH BAG SUKI  DESIGN, PACK OF 60 PINK PAISLEY CAKE CASES",2,100,0.71%,0.007107320540156361
"LUNCH BAG SUKI  DESIGN, PACK OF 60 SPACEBOY CAKE CASES",2,102,0.72%,0.007249466950959489
"LUNCH BAG SUKI  DESIGN, RED SPOTTY CHARLOTTE BAG",2,122,0.87%,0.00867093105899076
"LUNCH BAG SUKI  DESIGN, STRAWBERRY CHARLOTTE BAG",2,136,0.97%,0.009665955934612652
"LUNCH BAG SUKI  DESIGN, WHITE HANGING HEART T-LIGHT HOLDER",2,213,1.51%,0.015138592750533048
"PACK OF 60 DINOSAUR CAKE CASES, PACK OF 60 SPACEBOY CAKE CASES",2,216,1.54%,0.01535181236673774
"PACK OF 60 MUSHROOM CAKE CASES, PACK OF 60 SPACEBOY CAKE CASES",2,142,1.01%,0.010092395167022032
"PACK OF 60 PINK PAISLEY CAKE CASES, PACK OF 60 SPACEBOY CAKE CASES",2,205,1.46%,0.01457000710732054
"JUMBO SHOPPER VINTAGE RED PAISLEY, JUMBO STORAGE BAG SKULLS",2,167,1.19%,0.011869225302061123
"COOK WITH WINE METAL SIGN, METAL SIGN TAKE IT OR LEAVE IT",2,166,1.18%,0.01179815209665956
"LUNCH BAG  BLACK SKULL., LUNCH BAG SPACEBOY DESIGN",2,369,2.62%,0.026226012793176972
"LUNCH BAG CARS BLUE, LUNCH BAG SPACEBOY DESIGN",2,313,2.22%,0.02224591329068941
"LUNCH BAG SPACEBOY DESIGN, LUNCH BAG WOODLAND",2,332,2.36%,0.02359630419331912
"PACK OF 60 SPACEBOY CAKE CASES, PACK OF 72 SKULL CAKE CASES",2,173,1.23%,0.012295664534470504
"JUMBO BAG STRAWBERRY, RECYCLING BAG RETROSPOT",2,103,0.73%,0.007320540156361052
"JUMBO BAG WOODLAND ANIMALS, JUMBO SHOPPER VINTAGE RED PAISLEY",2,108,0.77%,0.00767590618336887
"LUNCH BAG CARS BLUE, LUNCH BAG SUKI  DESIGN",2,365,2.59%,0.025941719971570718
"LUNCH BAG SUKI  DESIGN, ROUND SNACK BOXES SET OF4 WOODLAND",2,121,0.86%,0.008599857853589197
"JUMBO BAG OWLS, JUMBO BAG SPACEBOY DESIGN",2,125,0.89%,0.008884150675195452
"JUMBO BAG SPACEBOY DESIGN, JUMBO STORAGE BAG SKULLS",2,139,0.99%,0.009879175550817342
"METAL SIGN TAKE IT OR LEAVE IT, WHITE HANGING HEART T-LIGHT HOLDER",2,131,0.93%,0.009310589907604833
"JUMBO BAG TOYS, JUMBO SHOPPER VINTAGE RED PAISLEY",2,139,0.99%,0.009879175550817342
"METAL SIGN TAKE IT OR LEAVE IT, PLEASE ONE PERSON METAL SIGN",2,144,1.02%,0.01023454157782516
"LUNCH BAG PINK RETROSPOT, TOY TIDY PINK RETROSPOT",2,111,0.79%,0.00788912579957356
"JUMBO STORAGE BAG SKULLS, LUNCH BAG SUKI  DESIGN",2,128,0.91%,0.009097370291400142
"LUNCH BAG  BLACK SKULL., LUNCH BAG SUKI  DESIGN",2,384,2.73%,0.027292110874200425
"METAL SIGN TAKE IT OR LEAVE IT, NO SINGING METAL SIGN",2,114,0.81%,0.00810234541577825
"LUNCH BAG SPACEBOY DESIGN, PACK OF 72 RETRO SPOT CAKE CASES",2,109,0.77%,0.007746979388770434
"LUNCH BAG SPACEBOY DESIGN, ROUND SNACK BOXES SET OF 4 FRUITS",2,118,0.84%,0.008386638237384506
"LUNCH BAG SUKI  DESIGN, PACK OF 72 RETRO SPOT CAKE CASES",2,119,0.85%,0.00845771144278607
"LUNCH BAG SUKI  DESIGN, ROUND SNACK BOXES SET OF 4 FRUITS",2,122,0.87%,0.00867093105899076
"HAND OVER THE CHOCOLATE   SIGN, METAL SIGN TAKE IT OR LEAVE IT",2,148,1.05%,0.010518834399431415
"BEWARE OF THE CAT METAL SIGN, PLEASE ONE PERSON METAL SIGN",2,119,0.85%,0.00845771144278607
"LUNCH BAG RED SPOTTY, LUNCH BAG SPACEBOY DESIGN",2,329,2.34%,0.023383084577114428
"LUNCH BAG RED SPOTTY, LUNCH BAG SUKI  DESIGN",2,353,2.51%,0.025088841506751954
"60 TEATIME FAIRY CAKE CASES, PACK OF 60 SPACEBOY CAKE CASES",2,247,1.76%,0.017555081734186212
"JUMBO BAG SPACEBOY DESIGN, JUMBO BAG STRAWBERRY",2,157,1.12%,0.011158493248045487
"JUMBO BAG SPACEBOY DESIGN, JUMBO BAG TOYS",2,110,0.78%,0.007818052594171997
"I CAN ONLY PLEASE ONE PERSON MUG, PLEASE ONE PERSON METAL SIGN",2,112,0.80%,0.007960199004975124
"RED TOADSTOOL LED NIGHT LIGHT, ROUND SNACK BOXES SET OF4 WOODLAND",2,105,0.75%,0.007462686567164179
"HOT BATHS METAL SIGN, PLEASE ONE PERSON METAL SIGN",2,113,0.80%,0.008031272210376687
"60 TEATIME FAIRY CAKE CASES, LUNCH BAG SPACEBOY DESIGN",2,117,0.83%,0.008315565031982943
"60 TEATIME FAIRY CAKE CASES, LUNCH BAG SUKI  DESIGN",2,145,1.03%,0.010305614783226724
"LUNCH BAG SUKI  DESIGN, LUNCH BAG WOODLAND",2,324,2.30%,0.02302771855010661
"LUNCH BAG SUKI  DESIGN, PACK OF 72 SKULL CAKE CASES",2,101,0.72%,0.007178393745557924
"JUMBO BAG PINK WITH WHITE SPOTS, LUNCH BAG CARS BLUE",2,124,0.88%,0.008813077469793887
"JUMBO BAG SPACEBOY DESIGN, LUNCH BAG PINK RETROSPOT",2,117,0.83%,0.008315565031982943
"JUMBO BAG SPACEBOY DESIGN, LUNCH BAG SPACEBOY DESIGN",2,177,1.26%,0.01257995735607676
"JUMBO BAG SPACEBOY DESIGN, LUNCH BAG SUKI  DESIGN",2,152,1.08%,0.010803127221037668
"LUNCH BAG SPACEBOY DESIGN, ROUND SNACK BOXES SET OF4 WOODLAND",2,103,0.73%,0.007320540156361052
"JUMBO BAG SPACEBOY DESIGN, LUNCH BAG  BLACK SKULL.",2,103,0.73%,0.007320540156361052
"JUMBO BAG SPACEBOY DESIGN, LUNCH BAG RED SPOTTY",2,115,0.82%,0.008173418621179816
"LUNCH BAG SPACEBOY DESIGN, RECYCLING BAG RETROSPOT",2,135,0.96%,0.009594882729211088
"JUMBO  BAG BAROQUE BLACK WHITE, LUNCH BAG SUKI  DESIGN",2,137,0.97%,0.009737029140014215
"LUNCH BAG SPACEBOY DESIGN, WOODLAND CHARLOTTE BAG",2,111,0.79%,0.00788912579957356
"LUNCH BAG SUKI  DESIGN, WOODLAND CHARLOTTE BAG",2,101,0.72%,0.007178393745557924
"LUNCH BAG SUKI  DESIGN, RECYCLING BAG RETROSPOT",2,118,0.84%,0.008386638237384506
"SMALL POPCORN HOLDER, WHITE HANGING HEART T-LIGHT HOLDER",2,121,0.86%,0.008599857853589197
"60 TEATIME FAIRY CAKE CASES, SMALL POPCORN HOLDER",2,101,0.72%,0.007178393745557924
"ASSORTED COLOUR BIRD ORNAMENT, NATURAL SLATE HEART CHALKBOARD",2,104,0.74%,0.0073916133617626155
"NATURAL SLATE HEART CHALKBOARD, WHITE HANGING HEART T-LIGHT HOLDER",2,225,1.60%,0.015991471215351813
"FELTCRAFT BUTTERFLY HEARTS, FELTCRAFT CUSHION BUTTERFLY",2,109,0.77%,0.007746979388770434
"FELTCRAFT CUSHION BUTTERFLY, PINK CREAM FELT CRAFT TRINKET BOX",2,103,0.73%,0.007320540156361052
"ASSORTED COLOUR BIRD ORNAMENT, PACK OF 6 BIRDY GIFT TAGS",2,155,1.10%,0.01101634683724236
"MEMO BOARD COTTAGE DESIGN, MEMO BOARD RETROSPOT  DESIGN",2,118,0.84%,0.008386638237384506
"MEMO BOARD COTTAGE DESIGN, WHITE HANGING HEART T-LIGHT HOLDER",2,103,0.73%,0.007320540156361052
"MEMO BOARD RETROSPOT  DESIGN, WHITE HANGING HEART T-LIGHT HOLDER",2,104,0.74%,0.0073916133617626155
"PACK OF 6 BIRDY GIFT TAGS, WHITE HANGING HEART T-LIGHT HOLDER",2,105,0.75%,0.007462686567164179
"BAKING SET 9 PIECE RETROSPOT, BAKING SET SPACEBOY DESIGN",2,233,1.66%,0.01656005685856432
"NATURAL SLATE HEART CHALKBOARD, REGENCY CAKESTAND 3 TIER",2,102,0.72%,0.007249466950959489
"60 TEATIME FAIRY CAKE CASES, REGENCY CAKESTAND 3 TIER",2,164,1.17%,0.011656005685856433
"PACK OF 60 PINK PAISLEY CAKE CASES, REGENCY CAKESTAND 3 TIER",2,168,1.19%,0.011940298507462687
"PACK OF 72 RETRO SPOT CAKE CASES, REGENCY CAKESTAND 3 TIER",2,147,1.04%,0.010447761194029851
"ASSORTED COLOUR BIRD ORNAMENT, REGENCY CAKESTAND 3 TIER",2,182,1.29%,0.012935323383084577
"HOME BUILDING BLOCK WORD, REGENCY CAKESTAND 3 TIER",2,173,1.23%,0.012295664534470504
"REGENCY CAKESTAND 3 TIER, STRAWBERRY CERAMIC TRINKET BOX",2,168,1.19%,0.011940298507462687
"REGENCY CAKESTAND 3 TIER, WHITE HANGING HEART T-LIGHT HOLDER",2,277,1.97%,0.01968727789623312
"JUMBO BAG STRAWBERRY, REGENCY CAKESTAND 3 TIER",2,103,0.73%,0.007320540156361052
"REGENCY CAKESTAND 3 TIER, SWEETHEART CERAMIC TRINKET BOX",2,138,0.98%,0.009808102345415778
"LOVE BUILDING BLOCK WORD, REGENCY CAKESTAND 3 TIER",2,124,0.88%,0.008813077469793887
"LUNCH BAG RED SPOTTY, REGENCY CAKESTAND 3 TIER",2,120,0.85%,0.008528784648187633
"6 RIBBONS RUSTIC CHARM, RIBBON REEL STRIPES DESIGN",2,102,0.72%,0.007249466950959489
"JUMBO SHOPPER VINTAGE RED PAISLEY, REGENCY CAKESTAND 3 TIER",2,121,0.86%,0.008599857853589197
"PACK OF 6 BIRDY GIFT TAGS, REGENCY CAKESTAND 3 TIER",2,134,0.95%,0.009523809523809525
"6 RIBBONS RUSTIC CHARM, PACK OF 6 BIRDY GIFT TAGS",2,108,0.77%,0.00767590618336887
"REGENCY CAKESTAND 3 TIER, RETRO SPOT TEA SET CERAMIC 11 PC",2,106,0.75%,0.007533759772565742
"6 RIBBONS RUSTIC CHARM, REGENCY CAKESTAND 3 TIER",2,119,0.85%,0.00845771144278607
"JUMBO STORAGE BAG SUKI, REGENCY CAKESTAND 3 TIER",2,117,0.83%,0.008315565031982943
"REGENCY CAKESTAND 3 TIER, VINTAGE UNION JACK BUNTING",2,109,0.77%,0.007746979388770434
"BAKING SET 9 PIECE RETROSPOT, REGENCY CAKESTAND 3 TIER",2,105,0.75%,0.007462686567164179
"REGENCY CAKESTAND 3 TIER, VICTORIAN GLASS HANGING T-LIGHT",2,100,0.71%,0.007107320540156361
"HOT WATER BOTTLE TEA AND SYMPATHY, REGENCY CAKESTAND 3 TIER",2,114,0.81%,0.00810234541577825
"RED HANGING HEART T-LIGHT HOLDER, REGENCY CAKESTAND 3 TIER",2,109,0.77%,0.007746979388770434
"ANTIQUE SILVER TEA GLASS ETCHED, REGENCY CAKESTAND 3 TIER",2,101,0.72%,0.007178393745557924
"PLASTERS IN TIN CIRCUS PARADE, PLASTERS IN TIN STRONGMAN",2,234,1.66%,0.016631130063965886
"PLASTERS IN TIN CIRCUS PARADE, PLASTERS IN TIN SPACEBOY",2,288,2.05%,0.02046908315565032
"LUNCH BAG  BLACK SKULL., PLASTERS IN TIN SKULLS",2,108,0.77%,0.00767590618336887
"LUNCH BAG SPACEBOY DESIGN, PLASTERS IN TIN SPACEBOY",2,125,0.89%,0.008884150675195452
"PACK OF 60 SPACEBOY CAKE CASES, PLASTERS IN TIN SPACEBOY",2,106,0.75%,0.007533759772565742
"PLASTERS IN TIN CIRCUS PARADE, PLASTERS IN TIN SKULLS",2,178,1.27%,0.012651030561478323
"PLASTERS IN TIN CIRCUS PARADE, PLASTERS IN TIN VINTAGE PAISLEY",2,194,1.38%,0.013788201847903341
"PLASTERS IN TIN SKULLS, PLASTERS IN TIN SPACEBOY",2,215,1.53%,0.015280739161336177
"PLASTERS IN TIN SKULLS, PLASTERS IN TIN VINTAGE PAISLEY",2,197,1.40%,0.014001421464108032
"PLASTERS IN TIN SPACEBOY, PLASTERS IN TIN VINTAGE PAISLEY",2,237,1.68%,0.016844349680170574
"PLASTERS IN TIN SPACEBOY, PLASTERS IN TIN WOODLAND ANIMALS",2,275,1.95%,0.01954513148542999
"PLASTERS IN TIN VINTAGE PAISLEY, PLASTERS IN TIN WOODLAND ANIMALS",2,192,1.36%,0.013646055437100213
"PLASTERS IN TIN SKULLS, PLASTERS IN TIN STRONGMAN",2,132,0.94%,0.009381663113006396
"PLASTERS IN TIN SPACEBOY, PLASTERS IN TIN STRONGMAN",2,196,1.39%,0.013930348258706468
"PLASTERS IN TIN STRONGMAN, PLASTERS IN TIN VINTAGE PAISLEY",2,164,1.17%,0.011656005685856433
"PLASTERS IN TIN CIRCUS PARADE, PLASTERS IN TIN WOODLAND ANIMALS",2,242,1.72%,0.017199715707178393
"PLASTERS IN TIN SKULLS, PLASTERS IN TIN WOODLAND ANIMALS",2,210,1.49%,0.014925373134328358
"PLASTERS IN TIN SKULLS, WHITE HANGING HEART T-LIGHT HOLDER",2,113,0.80%,0.008031272210376687
"PLASTERS IN TIN SPACEBOY, WHITE HANGING HEART T-LIGHT HOLDER",2,102,0.72%,0.007249466950959489
"PLASTERS IN TIN STRONGMAN, PLASTERS IN TIN WOODLAND ANIMALS",2,159,1.13%,0.011300639658848614
"PLASTERS IN TIN VINTAGE PAISLEY, WHITE HANGING HEART T-LIGHT HOLDER",2,103,0.73%,0.007320540156361052
"GARDENERS KNEELING PAD, WHITE HANGING HEART T-LIGHT HOLDER",2,133,0.95%,0.00945273631840796
"RED RETROSPOT SMALL MILK JUG, WHITE HANGING HEART T-LIGHT HOLDER",2,106,0.75%,0.007533759772565742
"RED RETROSPOT CAKE STAND, RED RETROSPOT SMALL MILK JUG",2,104,0.74%,0.0073916133617626155
"RED RETROSPOT CAKE STAND, REGENCY CAKESTAND 3 TIER",2,228,1.62%,0.0162046908315565
"RED RETROSPOT CAKE STAND, WHITE HANGING HEART T-LIGHT HOLDER",2,121,0.86%,0.008599857853589197
"RED RETROSPOT CAKE STAND, RED RETROSPOT TRADITIONAL TEAPOT",2,134,0.95%,0.009523809523809525
"RED RETROSPOT SMALL MILK JUG, RED RETROSPOT TRADITIONAL TEAPOT",2,159,1.13%,0.011300639658848614
"RED RETROSPOT SMALL MILK JUG, RETRO SPOT LARGE MILK JUG",2,145,1.03%,0.010305614783226724
"PACK OF 72 RETRO SPOT CAKE CASES, RED RETROSPOT CAKE STAND",2,122,0.87%,0.00867093105899076
"WHITE HANGING HEART T-LIGHT HOLDER, WOOD BLACK BOARD ANT WHITE FINISH",2,171,1.22%,0.012153518123667377
"WOOD BLACK BOARD ANT WHITE FINISH, WOOD S/3 CABINET ANT WHITE FINISH",2,106,0.75%,0.007533759772565742
"WOOD BLACK BOARD ANT WHITE FINISH, WOODEN FRAME ANTIQUE WHITE",2,148,1.05%,0.010518834399431415
"WOOD BLACK BOARD ANT WHITE FINISH, WOODEN PICTURE FRAME WHITE FINISH",2,127,0.90%,0.009026297085998579
"REGENCY CAKESTAND 3 TIER, WOODEN FRAME ANTIQUE WHITE",2,127,0.90%,0.009026297085998579
"REGENCY CAKESTAND 3 TIER, WOODEN PICTURE FRAME WHITE FINISH",2,108,0.77%,0.00767590618336887
"HEART OF WICKER LARGE, HEART OF WICKER SMALL",2,491,3.49%,0.03489694385216773
"HEART OF WICKER SMALL, REGENCY CAKESTAND 3 TIER",2,110,0.78%,0.007818052594171997
"HEART OF WICKER LARGE, WOODEN FRAME ANTIQUE WHITE",2,125,0.89%,0.008884150675195452
"HEART OF WICKER SMALL, WOODEN FRAME ANTIQUE WHITE",2,105,0.75%,0.007462686567164179
"HEART IVORY TRELLIS LARGE, HEART OF WICKER LARGE",2,128,0.91%,0.009097370291400142
"HEART OF WICKER LARGE, HOME BUILDING BLOCK WORD",2,153,1.09%,0.010874200426439232
"HEART OF WICKER LARGE, SWEETHEART CERAMIC TRINKET BOX",2,109,0.77%,0.007746979388770434
"HEART OF WICKER LARGE, WHITE HANGING HEART T-LIGHT HOLDER",2,380,2.70%,0.02700781805259417
"HEART OF WICKER SMALL, HOME BUILDING BLOCK WORD",2,127,0.90%,0.009026297085998579
"HEART OF WICKER SMALL, WHITE HANGING HEART T-LIGHT HOLDER",2,317,2.25%,0.022530206112295663
"ASSORTED COLOUR BIRD ORNAMENT, HEART OF WICKER SMALL",2,116,0.82%,0.00824449182658138
"HEART OF WICKER SMALL, LOVE BUILDING BLOCK WORD",2,128,0.91%,0.009097370291400142
"ASSORTED COLOUR BIRD ORNAMENT, HEART OF WICKER LARGE",2,135,0.96%,0.009594882729211088
"HEART OF WICKER LARGE, LOVE BUILDING BLOCK WORD",2,151,1.07%,0.010732054015636105
"HEART OF WICKER LARGE, REGENCY CAKESTAND 3 TIER",2,129,0.92%,0.009168443496801706
"HEART OF WICKER LARGE, LUNCH BAG  BLACK SKULL.",2,108,0.77%,0.00767590618336887
"HEART OF WICKER LARGE, LUNCH BAG SUKI  DESIGN",2,109,0.77%,0.007746979388770434
"HEART OF WICKER LARGE, STRAWBERRY CERAMIC TRINKET BOX",2,113,0.80%,0.008031272210376687
"HEART OF WICKER LARGE, WOODEN PICTURE FRAME WHITE FINISH",2,116,0.82%,0.00824449182658138
"HEART OF WICKER LARGE, REX CASH+CARRY JUMBO SHOPPER",2,130,0.92%,0.00923951670220327
"HEART OF WICKER LARGE, ZINC METAL HEART DECORATION",2,139,0.99%,0.009879175550817342
"HEART OF WICKER SMALL, ZINC METAL HEART DECORATION",2,112,0.80%,0.007960199004975124
"3 HEARTS HANGING DECORATION RUSTIC, HEART OF WICKER LARGE",2,134,0.95%,0.009523809523809525
"IVORY KITCHEN SCALES, REGENCY CAKESTAND 3 TIER",2,105,0.75%,0.007462686567164179
"IVORY KITCHEN SCALES, WHITE HANGING HEART T-LIGHT HOLDER",2,101,0.72%,0.007178393745557924
"HEART OF WICKER LARGE, NATURAL SLATE HEART CHALKBOARD",2,142,1.01%,0.010092395167022032
"HEART OF WICKER SMALL, NATURAL SLATE HEART CHALKBOARD",2,105,0.75%,0.007462686567164179
"3 HEARTS HANGING DECORATION RUSTIC, WHITE HANGING HEART T-LIGHT HOLDER",2,138,0.98%,0.009808102345415778
"HEART OF WICKER LARGE, RED HANGING HEART T-LIGHT HOLDER",2,153,1.09%,0.010874200426439232
"JUMBO  BAG BAROQUE BLACK WHITE, JUMBO BAG RED RETROSPOT",2,282,2.00%,0.020042643923240937
"JUMBO BAG OWLS, JUMBO BAG RED RETROSPOT",2,181,1.29%,0.012864250177683013
"JUMBO BAG PINK WITH WHITE SPOTS, JUMBO BAG RED RETROSPOT",2,231,1.64%,0.016417910447761194
"JUMBO BAG RED RETROSPOT, JUMBO BAG SPACEBOY DESIGN",2,176,1.25%,0.012508884150675196
"JUMBO BAG RED RETROSPOT, JUMBO BAG STRAWBERRY",2,320,2.27%,0.022743425728500355
"JUMBO BAG RED RETROSPOT, JUMBO BAG TOYS",2,137,0.97%,0.009737029140014215
"JUMBO BAG RED RETROSPOT, JUMBO BAG WOODLAND ANIMALS",2,133,0.95%,0.00945273631840796
"JUMBO BAG RED RETROSPOT, JUMBO SHOPPER VINTAGE RED PAISLEY",2,278,1.98%,0.019758351101634684
"JUMBO BAG RED RETROSPOT, JUMBO STORAGE BAG SKULLS",2,181,1.29%,0.012864250177683013
"JUMBO BAG RED RETROSPOT, JUMBO STORAGE BAG SUKI",2,315,2.24%,0.022388059701492536
"JUMBO BAG RED RETROSPOT, JUMBO BAG SCANDINAVIAN PAISLEY",2,198,1.41%,0.014072494669509595
"JUMBO BAG RED RETROSPOT, LUNCH BAG  BLACK SKULL.",2,161,1.14%,0.011442786069651741
"JUMBO BAG RED RETROSPOT, LUNCH BAG PINK RETROSPOT",2,130,0.92%,0.00923951670220327
"JUMBO BAG RED RETROSPOT, LUNCH BAG RED SPOTTY",2,182,1.29%,0.012935323383084577
"JUMBO BAG RED RETROSPOT, LUNCH BAG SUKI  DESIGN",2,193,1.37%,0.013717128642501776
"JUMBO BAG RED RETROSPOT, RECYCLING BAG RETROSPOT",2,137,0.97%,0.009737029140014215
"CERAMIC STRAWBERRY CAKE MONEY BANK, STRAWBERRY CERAMIC TRINKET BOX",2,191,1.36%,0.01357498223169865
"JUMBO BAG RED RETROSPOT, STRAWBERRY CERAMIC TRINKET BOX",2,104,0.74%,0.0073916133617626155
"60 TEATIME FAIRY CAKE CASES, JUMBO BAG RED RETROSPOT",2,112,0.80%,0.007960199004975124
"JUMBO BAG RED RETROSPOT, LUNCH BAG CARS BLUE",2,156,1.11%,0.011087420042643924
"JUMBO BAG RED RETROSPOT, LUNCH BAG SPACEBOY DESIGN",2,139,0.99%,0.009879175550817342
"JUMBO BAG RED RETROSPOT, LUNCH BAG WOODLAND",2,136,0.97%,0.009665955934612652
"CERAMIC STRAWBERRY CAKE MONEY BANK, SWEETHEART CERAMIC TRINKET BOX",2,144,1.02%,0.01023454157782516
"JUMBO BAG RED RETROSPOT, WHITE HANGING HEART T-LIGHT HOLDER",2,199,1.41%,0.014143567874911158
"CERAMIC STRAWBERRY CAKE MONEY BANK, WHITE HANGING HEART T-LIGHT HOLDER",2,107,0.76%,0.007604832977967307
